
*** Running vivado
    with args -log rgb2dvi_0.vds -m64 -product Vivado -mode batch -messageDb vivado.pb -notrace -source rgb2dvi_0.tcl


****** Vivado v2018.2 (64-bit)
  **** SW Build 2258646 on Thu Jun 14 20:03:12 MDT 2018
  **** IP Build 2256618 on Thu Jun 14 22:10:49 MDT 2018
    ** Copyright 1986-2018 Xilinx, Inc. All Rights Reserved.

source rgb2dvi_0.tcl -notrace
Command: synth_design -top rgb2dvi_0 -part xc7s15ftgb196-1 -mode out_of_context
Starting synth_design
Attempting to get a license for feature 'Synthesis' and/or device 'xc7s15'
INFO: [Common 17-349] Got license for feature 'Synthesis' and/or device 'xc7s15'
INFO: Launching helper process for spawning children vivado processes
INFO: Helper process launched with PID 38580 
---------------------------------------------------------------------------------
Starting RTL Elaboration : Time (s): cpu = 00:00:02 ; elapsed = 00:00:02 . Memory (MB): peak = 451.957 ; gain = 101.191
---------------------------------------------------------------------------------
INFO: [Synth 8-638] synthesizing module 'rgb2dvi_0' [c:/Users/Opex9020/Desktop/SEA-Tutorial/Experiment-of-SEA/FPGA-Demo-Project/ADC-Demo/ADC_Demo/ADC_Demo.srcs/sources_1/ip/rgb2dvi_0/synth/rgb2dvi_0.vhd:71]
	Parameter kGenerateSerialClk bound to: 1 - type: bool 
	Parameter kClkPrimitive bound to: PLL - type: string 
	Parameter kRstActiveHigh bound to: 0 - type: bool 
	Parameter kClkRange bound to: 1 - type: integer 
INFO: [Synth 8-3491] module 'rgb2dvi' declared at 'c:/Users/Opex9020/Desktop/SEA-Tutorial/Experiment-of-SEA/FPGA-Demo-Project/ADC-Demo/ADC_Demo/ADC_Demo.srcs/sources_1/ip/rgb2dvi_0/src/rgb2dvi.vhd:61' bound to instance 'U0' of component 'rgb2dvi' [c:/Users/Opex9020/Desktop/SEA-Tutorial/Experiment-of-SEA/FPGA-Demo-Project/ADC-Demo/ADC_Demo/ADC_Demo.srcs/sources_1/ip/rgb2dvi_0/synth/rgb2dvi_0.vhd:116]
INFO: [Synth 8-638] synthesizing module 'rgb2dvi' [c:/Users/Opex9020/Desktop/SEA-Tutorial/Experiment-of-SEA/FPGA-Demo-Project/ADC-Demo/ADC_Demo/ADC_Demo.srcs/sources_1/ip/rgb2dvi_0/src/rgb2dvi.vhd:89]
	Parameter kGenerateSerialClk bound to: 1 - type: bool 
	Parameter kClkPrimitive bound to: PLL - type: string 
	Parameter kClkRange bound to: 1 - type: integer 
	Parameter kRstActiveHigh bound to: 0 - type: bool 
INFO: [Synth 8-638] synthesizing module 'ClockGen' [c:/Users/Opex9020/Desktop/SEA-Tutorial/Experiment-of-SEA/FPGA-Demo-Project/ADC-Demo/ADC_Demo/ADC_Demo.srcs/sources_1/ip/rgb2dvi_0/xil_defaultlib/src/ClockGen.vhd:46]
	Parameter kClkRange bound to: 1 - type: integer 
	Parameter kClkPrimitive bound to: PLL - type: string 
	Parameter kPolarity bound to: 1'b1 
INFO: [Synth 8-3491] module 'ResetBridge' declared at 'c:/Users/Opex9020/Desktop/SEA-Tutorial/Experiment-of-SEA/FPGA-Demo-Project/ADC-Demo/ADC_Demo/ADC_Demo.srcs/sources_1/ip/rgb2dvi_0/xil_defaultlib/src/SyncAsyncReset.vhd:63' bound to instance 'LockLostReset' of component 'ResetBridge' [c:/Users/Opex9020/Desktop/SEA-Tutorial/Experiment-of-SEA/FPGA-Demo-Project/ADC-Demo/ADC_Demo/ADC_Demo.srcs/sources_1/ip/rgb2dvi_0/xil_defaultlib/src/ClockGen.vhd:77]
INFO: [Synth 8-638] synthesizing module 'ResetBridge' [c:/Users/Opex9020/Desktop/SEA-Tutorial/Experiment-of-SEA/FPGA-Demo-Project/ADC-Demo/ADC_Demo/ADC_Demo.srcs/sources_1/ip/rgb2dvi_0/xil_defaultlib/src/SyncAsyncReset.vhd:72]
	Parameter kPolarity bound to: 1'b1 
INFO: [Synth 8-5534] Detected attribute (* keep = "TRUE" *) [c:/Users/Opex9020/Desktop/SEA-Tutorial/Experiment-of-SEA/FPGA-Demo-Project/ADC-Demo/ADC_Demo/ADC_Demo.srcs/sources_1/ip/rgb2dvi_0/xil_defaultlib/src/SyncAsyncReset.vhd:73]
INFO: [Synth 8-638] synthesizing module 'SyncAsync' [c:/Users/Opex9020/Desktop/SEA-Tutorial/Experiment-of-SEA/FPGA-Demo-Project/ADC-Demo/ADC_Demo/ADC_Demo.srcs/sources_1/ip/rgb2dvi_0/xil_defaultlib/src/SyncAsync.vhd:72]
	Parameter kResetTo bound to: 1'b1 
	Parameter kStages bound to: 2 - type: integer 
INFO: [Synth 8-5534] Detected attribute (* async_reg = "TRUE" *) [c:/Users/Opex9020/Desktop/SEA-Tutorial/Experiment-of-SEA/FPGA-Demo-Project/ADC-Demo/ADC_Demo/ADC_Demo.srcs/sources_1/ip/rgb2dvi_0/xil_defaultlib/src/SyncAsync.vhd:73]
INFO: [Synth 8-256] done synthesizing module 'SyncAsync' (1#1) [c:/Users/Opex9020/Desktop/SEA-Tutorial/Experiment-of-SEA/FPGA-Demo-Project/ADC-Demo/ADC_Demo/ADC_Demo.srcs/sources_1/ip/rgb2dvi_0/xil_defaultlib/src/SyncAsync.vhd:72]
INFO: [Synth 8-256] done synthesizing module 'ResetBridge' (2#1) [c:/Users/Opex9020/Desktop/SEA-Tutorial/Experiment-of-SEA/FPGA-Demo-Project/ADC-Demo/ADC_Demo/ADC_Demo.srcs/sources_1/ip/rgb2dvi_0/xil_defaultlib/src/SyncAsyncReset.vhd:72]
	Parameter kResetTo bound to: 1'b0 
	Parameter kStages bound to: 2 - type: integer 
INFO: [Synth 8-3491] module 'SyncAsync' declared at 'c:/Users/Opex9020/Desktop/SEA-Tutorial/Experiment-of-SEA/FPGA-Demo-Project/ADC-Demo/ADC_Demo/ADC_Demo.srcs/sources_1/ip/rgb2dvi_0/xil_defaultlib/src/SyncAsync.vhd:61' bound to instance 'PLL_LockSyncAsync' of component 'SyncAsync' [c:/Users/Opex9020/Desktop/SEA-Tutorial/Experiment-of-SEA/FPGA-Demo-Project/ADC-Demo/ADC_Demo/ADC_Demo.srcs/sources_1/ip/rgb2dvi_0/xil_defaultlib/src/ClockGen.vhd:85]
INFO: [Synth 8-638] synthesizing module 'SyncAsync__parameterized1' [c:/Users/Opex9020/Desktop/SEA-Tutorial/Experiment-of-SEA/FPGA-Demo-Project/ADC-Demo/ADC_Demo/ADC_Demo.srcs/sources_1/ip/rgb2dvi_0/xil_defaultlib/src/SyncAsync.vhd:72]
	Parameter kResetTo bound to: 1'b0 
	Parameter kStages bound to: 2 - type: integer 
INFO: [Synth 8-256] done synthesizing module 'SyncAsync__parameterized1' (2#1) [c:/Users/Opex9020/Desktop/SEA-Tutorial/Experiment-of-SEA/FPGA-Demo-Project/ADC-Demo/ADC_Demo/ADC_Demo.srcs/sources_1/ip/rgb2dvi_0/xil_defaultlib/src/SyncAsync.vhd:72]
WARNING: [Synth 8-614] signal 'pRst' is read in the process but is not in the sensitivity list [c:/Users/Opex9020/Desktop/SEA-Tutorial/Experiment-of-SEA/FPGA-Demo-Project/ADC-Demo/ADC_Demo/ADC_Demo.srcs/sources_1/ip/rgb2dvi_0/xil_defaultlib/src/ClockGen.vhd:92]
	Parameter BANDWIDTH bound to: OPTIMIZED - type: string 
	Parameter CLKFBOUT_MULT bound to: 10 - type: integer 
	Parameter CLKFBOUT_PHASE bound to: 0.000000 - type: float 
	Parameter CLKIN1_PERIOD bound to: 6.250000 - type: float 
	Parameter CLKIN2_PERIOD bound to: 0.000000 - type: float 
	Parameter CLKOUT0_DIVIDE bound to: 2 - type: integer 
	Parameter CLKOUT0_DUTY_CYCLE bound to: 0.500000 - type: float 
	Parameter CLKOUT0_PHASE bound to: 0.000000 - type: float 
	Parameter CLKOUT1_DIVIDE bound to: 10 - type: integer 
	Parameter CLKOUT1_DUTY_CYCLE bound to: 0.500000 - type: float 
	Parameter CLKOUT1_PHASE bound to: 0.000000 - type: float 
	Parameter CLKOUT2_DIVIDE bound to: 1 - type: integer 
	Parameter CLKOUT2_DUTY_CYCLE bound to: 0.500000 - type: float 
	Parameter CLKOUT2_PHASE bound to: 0.000000 - type: float 
	Parameter CLKOUT3_DIVIDE bound to: 1 - type: integer 
	Parameter CLKOUT3_DUTY_CYCLE bound to: 0.500000 - type: float 
	Parameter CLKOUT3_PHASE bound to: 0.000000 - type: float 
	Parameter CLKOUT4_DIVIDE bound to: 1 - type: integer 
	Parameter CLKOUT4_DUTY_CYCLE bound to: 0.500000 - type: float 
	Parameter CLKOUT4_PHASE bound to: 0.000000 - type: float 
	Parameter CLKOUT5_DIVIDE bound to: 1 - type: integer 
	Parameter CLKOUT5_DUTY_CYCLE bound to: 0.500000 - type: float 
	Parameter CLKOUT5_PHASE bound to: 0.000000 - type: float 
	Parameter COMPENSATION bound to: ZHOLD - type: string 
	Parameter DIVCLK_DIVIDE bound to: 1 - type: integer 
	Parameter IS_CLKINSEL_INVERTED bound to: 1'b0 
	Parameter IS_PWRDWN_INVERTED bound to: 1'b0 
	Parameter IS_RST_INVERTED bound to: 1'b0 
	Parameter REF_JITTER1 bound to: 0.010000 - type: float 
	Parameter REF_JITTER2 bound to: 0.000000 - type: float 
	Parameter STARTUP_WAIT bound to: FALSE - type: string 
INFO: [Synth 8-113] binding component instance 'DVI_ClkGenerator' to cell 'PLLE2_ADV' [c:/Users/Opex9020/Desktop/SEA-Tutorial/Experiment-of-SEA/FPGA-Demo-Project/ADC-Demo/ADC_Demo/ADC_Demo.srcs/sources_1/ip/rgb2dvi_0/xil_defaultlib/src/ClockGen.vhd:198]
INFO: [Synth 8-256] done synthesizing module 'ClockGen' (3#1) [c:/Users/Opex9020/Desktop/SEA-Tutorial/Experiment-of-SEA/FPGA-Demo-Project/ADC-Demo/ADC_Demo/ADC_Demo.srcs/sources_1/ip/rgb2dvi_0/xil_defaultlib/src/ClockGen.vhd:46]
INFO: [Synth 8-638] synthesizing module 'OutputSERDES' [c:/Users/Opex9020/Desktop/SEA-Tutorial/Experiment-of-SEA/FPGA-Demo-Project/ADC-Demo/ADC_Demo/ADC_Demo.srcs/sources_1/ip/rgb2dvi_0/src/OutputSERDES.vhd:76]
	Parameter kParallelWidth bound to: 10 - type: integer 
	Parameter CAPACITANCE bound to: DONT_CARE - type: string 
	Parameter IOSTANDARD bound to: TMDS_33 - type: string 
	Parameter SLEW bound to: SLOW - type: string 
INFO: [Synth 8-113] binding component instance 'OutputBuffer' to cell 'OBUFDS' [c:/Users/Opex9020/Desktop/SEA-Tutorial/Experiment-of-SEA/FPGA-Demo-Project/ADC-Demo/ADC_Demo/ADC_Demo.srcs/sources_1/ip/rgb2dvi_0/src/OutputSERDES.vhd:83]
	Parameter DATA_RATE_OQ bound to: DDR - type: string 
	Parameter DATA_RATE_TQ bound to: SDR - type: string 
	Parameter DATA_WIDTH bound to: 10 - type: integer 
	Parameter INIT_OQ bound to: 1'b0 
	Parameter INIT_TQ bound to: 1'b0 
	Parameter IS_CLKDIV_INVERTED bound to: 1'b0 
	Parameter IS_CLK_INVERTED bound to: 1'b0 
	Parameter IS_D1_INVERTED bound to: 1'b0 
	Parameter IS_D2_INVERTED bound to: 1'b0 
	Parameter IS_D3_INVERTED bound to: 1'b0 
	Parameter IS_D4_INVERTED bound to: 1'b0 
	Parameter IS_D5_INVERTED bound to: 1'b0 
	Parameter IS_D6_INVERTED bound to: 1'b0 
	Parameter IS_D7_INVERTED bound to: 1'b0 
	Parameter IS_D8_INVERTED bound to: 1'b0 
	Parameter IS_T1_INVERTED bound to: 1'b0 
	Parameter IS_T2_INVERTED bound to: 1'b0 
	Parameter IS_T3_INVERTED bound to: 1'b0 
	Parameter IS_T4_INVERTED bound to: 1'b0 
	Parameter SERDES_MODE bound to: MASTER - type: string 
	Parameter SRVAL_OQ bound to: 1'b0 
	Parameter SRVAL_TQ bound to: 1'b0 
	Parameter TBYTE_CTL bound to: FALSE - type: string 
	Parameter TBYTE_SRC bound to: FALSE - type: string 
	Parameter TRISTATE_WIDTH bound to: 1 - type: integer 
INFO: [Synth 8-113] binding component instance 'SerializerMaster' to cell 'OSERDESE2' [c:/Users/Opex9020/Desktop/SEA-Tutorial/Experiment-of-SEA/FPGA-Demo-Project/ADC-Demo/ADC_Demo/ADC_Demo.srcs/sources_1/ip/rgb2dvi_0/src/OutputSERDES.vhd:92]
	Parameter DATA_RATE_OQ bound to: DDR - type: string 
	Parameter DATA_RATE_TQ bound to: SDR - type: string 
	Parameter DATA_WIDTH bound to: 10 - type: integer 
	Parameter INIT_OQ bound to: 1'b0 
	Parameter INIT_TQ bound to: 1'b0 
	Parameter IS_CLKDIV_INVERTED bound to: 1'b0 
	Parameter IS_CLK_INVERTED bound to: 1'b0 
	Parameter IS_D1_INVERTED bound to: 1'b0 
	Parameter IS_D2_INVERTED bound to: 1'b0 
	Parameter IS_D3_INVERTED bound to: 1'b0 
	Parameter IS_D4_INVERTED bound to: 1'b0 
	Parameter IS_D5_INVERTED bound to: 1'b0 
	Parameter IS_D6_INVERTED bound to: 1'b0 
	Parameter IS_D7_INVERTED bound to: 1'b0 
	Parameter IS_D8_INVERTED bound to: 1'b0 
	Parameter IS_T1_INVERTED bound to: 1'b0 
	Parameter IS_T2_INVERTED bound to: 1'b0 
	Parameter IS_T3_INVERTED bound to: 1'b0 
	Parameter IS_T4_INVERTED bound to: 1'b0 
	Parameter SERDES_MODE bound to: SLAVE - type: string 
	Parameter SRVAL_OQ bound to: 1'b0 
	Parameter SRVAL_TQ bound to: 1'b0 
	Parameter TBYTE_CTL bound to: FALSE - type: string 
	Parameter TBYTE_SRC bound to: FALSE - type: string 
	Parameter TRISTATE_WIDTH bound to: 1 - type: integer 
INFO: [Synth 8-113] binding component instance 'SerializerSlave' to cell 'OSERDESE2' [c:/Users/Opex9020/Desktop/SEA-Tutorial/Experiment-of-SEA/FPGA-Demo-Project/ADC-Demo/ADC_Demo/ADC_Demo.srcs/sources_1/ip/rgb2dvi_0/src/OutputSERDES.vhd:135]
INFO: [Synth 8-256] done synthesizing module 'OutputSERDES' (4#1) [c:/Users/Opex9020/Desktop/SEA-Tutorial/Experiment-of-SEA/FPGA-Demo-Project/ADC-Demo/ADC_Demo/ADC_Demo.srcs/sources_1/ip/rgb2dvi_0/src/OutputSERDES.vhd:76]
INFO: [Synth 8-638] synthesizing module 'TMDS_Encoder' [c:/Users/Opex9020/Desktop/SEA-Tutorial/Experiment-of-SEA/FPGA-Demo-Project/ADC-Demo/ADC_Demo/ADC_Demo.srcs/sources_1/ip/rgb2dvi_0/src/TMDS_Encoder.vhd:80]
INFO: [Synth 8-256] done synthesizing module 'TMDS_Encoder' (5#1) [c:/Users/Opex9020/Desktop/SEA-Tutorial/Experiment-of-SEA/FPGA-Demo-Project/ADC-Demo/ADC_Demo/ADC_Demo.srcs/sources_1/ip/rgb2dvi_0/src/TMDS_Encoder.vhd:80]
INFO: [Synth 8-256] done synthesizing module 'rgb2dvi' (6#1) [c:/Users/Opex9020/Desktop/SEA-Tutorial/Experiment-of-SEA/FPGA-Demo-Project/ADC-Demo/ADC_Demo/ADC_Demo.srcs/sources_1/ip/rgb2dvi_0/src/rgb2dvi.vhd:89]
INFO: [Synth 8-256] done synthesizing module 'rgb2dvi_0' (7#1) [c:/Users/Opex9020/Desktop/SEA-Tutorial/Experiment-of-SEA/FPGA-Demo-Project/ADC-Demo/ADC_Demo/ADC_Demo.srcs/sources_1/ip/rgb2dvi_0/synth/rgb2dvi_0.vhd:71]
WARNING: [Synth 8-3331] design TMDS_Encoder has unconnected port SerialClk
WARNING: [Synth 8-3331] design TMDS_Encoder has unconnected port aRst
WARNING: [Synth 8-3331] design rgb2dvi has unconnected port aRst
---------------------------------------------------------------------------------
Finished RTL Elaboration : Time (s): cpu = 00:00:03 ; elapsed = 00:00:03 . Memory (MB): peak = 507.160 ; gain = 156.395
---------------------------------------------------------------------------------

Report Check Netlist: 
+------+------------------+-------+---------+-------+------------------+
|      |Item              |Errors |Warnings |Status |Description       |
+------+------------------+-------+---------+-------+------------------+
|1     |multi_driven_nets |      0|        0|Passed |Multi driven nets |
+------+------------------+-------+---------+-------+------------------+
---------------------------------------------------------------------------------
Start Handling Custom Attributes
---------------------------------------------------------------------------------
---------------------------------------------------------------------------------
Finished Handling Custom Attributes : Time (s): cpu = 00:00:03 ; elapsed = 00:00:03 . Memory (MB): peak = 507.160 ; gain = 156.395
---------------------------------------------------------------------------------
---------------------------------------------------------------------------------
Finished RTL Optimization Phase 1 : Time (s): cpu = 00:00:03 ; elapsed = 00:00:03 . Memory (MB): peak = 507.160 ; gain = 156.395
---------------------------------------------------------------------------------
INFO: [Netlist 29-17] Analyzing 5 Unisim elements for replacement
INFO: [Netlist 29-28] Unisim Transformation completed in 0 CPU seconds
INFO: [Device 21-403] Loading part xc7s15ftgb196-1
INFO: [Project 1-570] Preparing netlist for logic optimization

Processing XDC Constraints
Initializing timing engine
Parsing XDC File [c:/Users/Opex9020/Desktop/SEA-Tutorial/Experiment-of-SEA/FPGA-Demo-Project/ADC-Demo/ADC_Demo/ADC_Demo.srcs/sources_1/ip/rgb2dvi_0/src/rgb2dvi_ooc.xdc] for cell 'U0'
Finished Parsing XDC File [c:/Users/Opex9020/Desktop/SEA-Tutorial/Experiment-of-SEA/FPGA-Demo-Project/ADC-Demo/ADC_Demo/ADC_Demo.srcs/sources_1/ip/rgb2dvi_0/src/rgb2dvi_ooc.xdc] for cell 'U0'
Parsing XDC File [c:/Users/Opex9020/Desktop/SEA-Tutorial/Experiment-of-SEA/FPGA-Demo-Project/ADC-Demo/ADC_Demo/ADC_Demo.srcs/sources_1/ip/rgb2dvi_0/src/rgb2dvi.xdc] for cell 'U0'
Finished Parsing XDC File [c:/Users/Opex9020/Desktop/SEA-Tutorial/Experiment-of-SEA/FPGA-Demo-Project/ADC-Demo/ADC_Demo/ADC_Demo.srcs/sources_1/ip/rgb2dvi_0/src/rgb2dvi.xdc] for cell 'U0'
Parsing XDC File [C:/Users/Opex9020/Desktop/SEA-Tutorial/Experiment-of-SEA/FPGA-Demo-Project/ADC-Demo/ADC_Demo/ADC_Demo.runs/rgb2dvi_0_synth_1/dont_touch.xdc]
Finished Parsing XDC File [C:/Users/Opex9020/Desktop/SEA-Tutorial/Experiment-of-SEA/FPGA-Demo-Project/ADC-Demo/ADC_Demo/ADC_Demo.runs/rgb2dvi_0_synth_1/dont_touch.xdc]
Parsing XDC File [c:/Users/Opex9020/Desktop/SEA-Tutorial/Experiment-of-SEA/FPGA-Demo-Project/ADC-Demo/ADC_Demo/ADC_Demo.srcs/sources_1/ip/rgb2dvi_0/src/rgb2dvi_clocks.xdc] for cell 'U0'
WARNING: [Constraints 18-619] A clock with name 'U0/SerialClk' already exists, overwriting the previous clock with the same name. [c:/Users/Opex9020/Desktop/SEA-Tutorial/Experiment-of-SEA/FPGA-Demo-Project/ADC-Demo/ADC_Demo/ADC_Demo.srcs/sources_1/ip/rgb2dvi_0/src/rgb2dvi_clocks.xdc:2]
Finished Parsing XDC File [c:/Users/Opex9020/Desktop/SEA-Tutorial/Experiment-of-SEA/FPGA-Demo-Project/ADC-Demo/ADC_Demo/ADC_Demo.srcs/sources_1/ip/rgb2dvi_0/src/rgb2dvi_clocks.xdc] for cell 'U0'
Completed Processing XDC Constraints

INFO: [Project 1-111] Unisim Transformation Summary:
No Unisim elements were transformed.

INFO: [Timing 38-2] Deriving generated clocks
Constraint Validation Runtime : Time (s): cpu = 00:00:00 ; elapsed = 00:00:00.072 . Memory (MB): peak = 804.219 ; gain = 0.000
---------------------------------------------------------------------------------
Finished Constraint Validation : Time (s): cpu = 00:00:10 ; elapsed = 00:00:12 . Memory (MB): peak = 804.219 ; gain = 453.453
---------------------------------------------------------------------------------
---------------------------------------------------------------------------------
Start Loading Part and Timing Information
---------------------------------------------------------------------------------
Loading part: xc7s15ftgb196-1
---------------------------------------------------------------------------------
Finished Loading Part and Timing Information : Time (s): cpu = 00:00:10 ; elapsed = 00:00:12 . Memory (MB): peak = 804.219 ; gain = 453.453
---------------------------------------------------------------------------------
---------------------------------------------------------------------------------
Start Applying 'set_property' XDC Constraints
---------------------------------------------------------------------------------
Applied set_property DONT_TOUCH = true for U0. (constraint file  C:/Users/Opex9020/Desktop/SEA-Tutorial/Experiment-of-SEA/FPGA-Demo-Project/ADC-Demo/ADC_Demo/ADC_Demo.runs/rgb2dvi_0_synth_1/dont_touch.xdc, line 9).
---------------------------------------------------------------------------------
Finished applying 'set_property' XDC Constraints : Time (s): cpu = 00:00:10 ; elapsed = 00:00:12 . Memory (MB): peak = 804.219 ; gain = 453.453
---------------------------------------------------------------------------------
---------------------------------------------------------------------------------
Finished RTL Optimization Phase 2 : Time (s): cpu = 00:00:10 ; elapsed = 00:00:13 . Memory (MB): peak = 804.219 ; gain = 453.453
---------------------------------------------------------------------------------

Report RTL Partitions: 
+-+--------------+------------+----------+
| |RTL Partition |Replication |Instances |
+-+--------------+------------+----------+
+-+--------------+------------+----------+
---------------------------------------------------------------------------------
Start RTL Component Statistics 
---------------------------------------------------------------------------------
Detailed RTL Component Info : 
+---Adders : 
	   3 Input      5 Bit       Adders := 9     
	   4 Input      5 Bit       Adders := 3     
	   2 Input      5 Bit       Adders := 3     
	   8 Input      4 Bit       Adders := 6     
	   2 Input      4 Bit       Adders := 3     
+---XORs : 
	   2 Input      1 Bit         XORs := 42    
+---Registers : 
	               10 Bit    Registers := 3     
	                9 Bit    Registers := 3     
	                8 Bit    Registers := 3     
	                5 Bit    Registers := 3     
	                4 Bit    Registers := 9     
	                3 Bit    Registers := 1     
	                2 Bit    Registers := 3     
	                1 Bit    Registers := 19    
+---Muxes : 
	   4 Input     10 Bit        Muxes := 3     
	   2 Input     10 Bit        Muxes := 9     
	   2 Input      9 Bit        Muxes := 3     
	   2 Input      5 Bit        Muxes := 9     
---------------------------------------------------------------------------------
Finished RTL Component Statistics 
---------------------------------------------------------------------------------
---------------------------------------------------------------------------------
Start RTL Hierarchical Component Statistics 
---------------------------------------------------------------------------------
Hierarchical RTL Component report 
Module SyncAsync 
Detailed RTL Component Info : 
+---Registers : 
	                2 Bit    Registers := 1     
Module SyncAsync__parameterized1 
Detailed RTL Component Info : 
+---Registers : 
	                2 Bit    Registers := 1     
Module ClockGen 
Detailed RTL Component Info : 
+---Registers : 
	                3 Bit    Registers := 1     
	                1 Bit    Registers := 1     
Module TMDS_Encoder 
Detailed RTL Component Info : 
+---Adders : 
	   3 Input      5 Bit       Adders := 3     
	   4 Input      5 Bit       Adders := 1     
	   2 Input      5 Bit       Adders := 1     
	   8 Input      4 Bit       Adders := 2     
	   2 Input      4 Bit       Adders := 1     
+---XORs : 
	   2 Input      1 Bit         XORs := 14    
+---Registers : 
	               10 Bit    Registers := 1     
	                9 Bit    Registers := 1     
	                8 Bit    Registers := 1     
	                5 Bit    Registers := 1     
	                4 Bit    Registers := 3     
	                1 Bit    Registers := 6     
+---Muxes : 
	   4 Input     10 Bit        Muxes := 1     
	   2 Input     10 Bit        Muxes := 3     
	   2 Input      9 Bit        Muxes := 1     
	   2 Input      5 Bit        Muxes := 3     
---------------------------------------------------------------------------------
Finished RTL Hierarchical Component Statistics
---------------------------------------------------------------------------------
---------------------------------------------------------------------------------
Start Part Resource Summary
---------------------------------------------------------------------------------
Part Resources:
DSPs: 20 (col length:20)
BRAMs: 20 (col length: RAMB18 20 RAMB36 10)
---------------------------------------------------------------------------------
Finished Part Resource Summary
---------------------------------------------------------------------------------
---------------------------------------------------------------------------------
Start Cross Boundary and Area Optimization
---------------------------------------------------------------------------------
Warning: Parallel synthesis criteria is not met 
INFO: [Synth 8-4471] merging register 'DataEncoders[1].DataEncoder/pC1_1_reg' into 'DataEncoders[1].DataEncoder/pC0_1_reg' [c:/Users/Opex9020/Desktop/SEA-Tutorial/Experiment-of-SEA/FPGA-Demo-Project/ADC-Demo/ADC_Demo/ADC_Demo.srcs/sources_1/ip/rgb2dvi_0/src/TMDS_Encoder.vhd:115]
INFO: [Synth 8-4471] merging register 'DataEncoders[1].DataEncoder/pC1_2_reg' into 'DataEncoders[1].DataEncoder/pC0_2_reg' [c:/Users/Opex9020/Desktop/SEA-Tutorial/Experiment-of-SEA/FPGA-Demo-Project/ADC-Demo/ADC_Demo/ADC_Demo.srcs/sources_1/ip/rgb2dvi_0/src/TMDS_Encoder.vhd:149]
INFO: [Synth 8-4471] merging register 'DataEncoders[1].DataEncoder/pVde_1_reg' into 'DataEncoders[0].DataEncoder/pVde_1_reg' [c:/Users/Opex9020/Desktop/SEA-Tutorial/Experiment-of-SEA/FPGA-Demo-Project/ADC-Demo/ADC_Demo/ADC_Demo.srcs/sources_1/ip/rgb2dvi_0/src/TMDS_Encoder.vhd:110]
INFO: [Synth 8-4471] merging register 'DataEncoders[1].DataEncoder/pVde_2_reg' into 'DataEncoders[0].DataEncoder/pVde_2_reg' [c:/Users/Opex9020/Desktop/SEA-Tutorial/Experiment-of-SEA/FPGA-Demo-Project/ADC-Demo/ADC_Demo/ADC_Demo.srcs/sources_1/ip/rgb2dvi_0/src/TMDS_Encoder.vhd:150]
INFO: [Synth 8-4471] merging register 'DataEncoders[2].DataEncoder/pC0_1_reg' into 'DataEncoders[1].DataEncoder/pC0_1_reg' [c:/Users/Opex9020/Desktop/SEA-Tutorial/Experiment-of-SEA/FPGA-Demo-Project/ADC-Demo/ADC_Demo/ADC_Demo.srcs/sources_1/ip/rgb2dvi_0/src/TMDS_Encoder.vhd:114]
INFO: [Synth 8-4471] merging register 'DataEncoders[2].DataEncoder/pC0_2_reg' into 'DataEncoders[1].DataEncoder/pC0_2_reg' [c:/Users/Opex9020/Desktop/SEA-Tutorial/Experiment-of-SEA/FPGA-Demo-Project/ADC-Demo/ADC_Demo/ADC_Demo.srcs/sources_1/ip/rgb2dvi_0/src/TMDS_Encoder.vhd:148]
INFO: [Synth 8-4471] merging register 'DataEncoders[2].DataEncoder/pC1_1_reg' into 'DataEncoders[1].DataEncoder/pC0_1_reg' [c:/Users/Opex9020/Desktop/SEA-Tutorial/Experiment-of-SEA/FPGA-Demo-Project/ADC-Demo/ADC_Demo/ADC_Demo.srcs/sources_1/ip/rgb2dvi_0/src/TMDS_Encoder.vhd:115]
INFO: [Synth 8-4471] merging register 'DataEncoders[2].DataEncoder/pC1_2_reg' into 'DataEncoders[1].DataEncoder/pC0_2_reg' [c:/Users/Opex9020/Desktop/SEA-Tutorial/Experiment-of-SEA/FPGA-Demo-Project/ADC-Demo/ADC_Demo/ADC_Demo.srcs/sources_1/ip/rgb2dvi_0/src/TMDS_Encoder.vhd:149]
INFO: [Synth 8-4471] merging register 'DataEncoders[2].DataEncoder/pVde_1_reg' into 'DataEncoders[0].DataEncoder/pVde_1_reg' [c:/Users/Opex9020/Desktop/SEA-Tutorial/Experiment-of-SEA/FPGA-Demo-Project/ADC-Demo/ADC_Demo/ADC_Demo.srcs/sources_1/ip/rgb2dvi_0/src/TMDS_Encoder.vhd:110]
INFO: [Synth 8-4471] merging register 'DataEncoders[2].DataEncoder/pVde_2_reg' into 'DataEncoders[0].DataEncoder/pVde_2_reg' [c:/Users/Opex9020/Desktop/SEA-Tutorial/Experiment-of-SEA/FPGA-Demo-Project/ADC-Demo/ADC_Demo/ADC_Demo.srcs/sources_1/ip/rgb2dvi_0/src/TMDS_Encoder.vhd:150]
WARNING: [Synth 8-6014] Unused sequential element DataEncoders[1].DataEncoder/pC1_1_reg was removed.  [c:/Users/Opex9020/Desktop/SEA-Tutorial/Experiment-of-SEA/FPGA-Demo-Project/ADC-Demo/ADC_Demo/ADC_Demo.srcs/sources_1/ip/rgb2dvi_0/src/TMDS_Encoder.vhd:115]
WARNING: [Synth 8-6014] Unused sequential element DataEncoders[1].DataEncoder/pC1_2_reg was removed.  [c:/Users/Opex9020/Desktop/SEA-Tutorial/Experiment-of-SEA/FPGA-Demo-Project/ADC-Demo/ADC_Demo/ADC_Demo.srcs/sources_1/ip/rgb2dvi_0/src/TMDS_Encoder.vhd:149]
WARNING: [Synth 8-6014] Unused sequential element DataEncoders[1].DataEncoder/pVde_1_reg was removed.  [c:/Users/Opex9020/Desktop/SEA-Tutorial/Experiment-of-SEA/FPGA-Demo-Project/ADC-Demo/ADC_Demo/ADC_Demo.srcs/sources_1/ip/rgb2dvi_0/src/TMDS_Encoder.vhd:110]
WARNING: [Synth 8-6014] Unused sequential element DataEncoders[1].DataEncoder/pVde_2_reg was removed.  [c:/Users/Opex9020/Desktop/SEA-Tutorial/Experiment-of-SEA/FPGA-Demo-Project/ADC-Demo/ADC_Demo/ADC_Demo.srcs/sources_1/ip/rgb2dvi_0/src/TMDS_Encoder.vhd:150]
WARNING: [Synth 8-6014] Unused sequential element DataEncoders[2].DataEncoder/pC0_1_reg was removed.  [c:/Users/Opex9020/Desktop/SEA-Tutorial/Experiment-of-SEA/FPGA-Demo-Project/ADC-Demo/ADC_Demo/ADC_Demo.srcs/sources_1/ip/rgb2dvi_0/src/TMDS_Encoder.vhd:114]
WARNING: [Synth 8-6014] Unused sequential element DataEncoders[2].DataEncoder/pC0_2_reg was removed.  [c:/Users/Opex9020/Desktop/SEA-Tutorial/Experiment-of-SEA/FPGA-Demo-Project/ADC-Demo/ADC_Demo/ADC_Demo.srcs/sources_1/ip/rgb2dvi_0/src/TMDS_Encoder.vhd:148]
WARNING: [Synth 8-6014] Unused sequential element DataEncoders[2].DataEncoder/pC1_1_reg was removed.  [c:/Users/Opex9020/Desktop/SEA-Tutorial/Experiment-of-SEA/FPGA-Demo-Project/ADC-Demo/ADC_Demo/ADC_Demo.srcs/sources_1/ip/rgb2dvi_0/src/TMDS_Encoder.vhd:115]
WARNING: [Synth 8-6014] Unused sequential element DataEncoders[2].DataEncoder/pC1_2_reg was removed.  [c:/Users/Opex9020/Desktop/SEA-Tutorial/Experiment-of-SEA/FPGA-Demo-Project/ADC-Demo/ADC_Demo/ADC_Demo.srcs/sources_1/ip/rgb2dvi_0/src/TMDS_Encoder.vhd:149]
WARNING: [Synth 8-6014] Unused sequential element DataEncoders[2].DataEncoder/pVde_1_reg was removed.  [c:/Users/Opex9020/Desktop/SEA-Tutorial/Experiment-of-SEA/FPGA-Demo-Project/ADC-Demo/ADC_Demo/ADC_Demo.srcs/sources_1/ip/rgb2dvi_0/src/TMDS_Encoder.vhd:110]
WARNING: [Synth 8-6014] Unused sequential element DataEncoders[2].DataEncoder/pVde_2_reg was removed.  [c:/Users/Opex9020/Desktop/SEA-Tutorial/Experiment-of-SEA/FPGA-Demo-Project/ADC-Demo/ADC_Demo/ADC_Demo.srcs/sources_1/ip/rgb2dvi_0/src/TMDS_Encoder.vhd:150]
WARNING: [Synth 8-3331] design rgb2dvi has unconnected port aRst
WARNING: [Synth 8-3331] design rgb2dvi has unconnected port SerialClk
INFO: [Synth 8-3886] merging instance 'U0/DataEncoders[0].DataEncoder/n0q_m_2_reg[0]' (FD) to 'U0/DataEncoders[0].DataEncoder/n1q_m_2_reg[0]'
INFO: [Synth 8-3886] merging instance 'U0/DataEncoders[1].DataEncoder/n0q_m_2_reg[0]' (FD) to 'U0/DataEncoders[1].DataEncoder/n1q_m_2_reg[0]'
INFO: [Synth 8-3886] merging instance 'U0/DataEncoders[2].DataEncoder/n0q_m_2_reg[0]' (FD) to 'U0/DataEncoders[2].DataEncoder/n1q_m_2_reg[0]'
INFO: [Synth 8-3333] propagating constant 0 across sequential element (U0/\DataEncoders[1].DataEncoder/pC0_1_reg )
INFO: [Synth 8-3886] merging instance 'U0/DataEncoders[1].DataEncoder/pC0_2_reg' (FD) to 'U0/DataEncoders[1].DataEncoder/pC0_1_reg'
INFO: [Synth 8-3333] propagating constant 0 across sequential element (U0/\DataEncoders[1].DataEncoder/pC0_1_reg )
WARNING: [Synth 8-3332] Sequential element (DataEncoders[0].DataEncoder/cnt_t_3_reg[0]) is unused and will be removed from module rgb2dvi.
WARNING: [Synth 8-3332] Sequential element (DataEncoders[1].DataEncoder/pC0_1_reg) is unused and will be removed from module rgb2dvi.
WARNING: [Synth 8-3332] Sequential element (DataEncoders[1].DataEncoder/cnt_t_3_reg[0]) is unused and will be removed from module rgb2dvi.
WARNING: [Synth 8-3332] Sequential element (DataEncoders[2].DataEncoder/cnt_t_3_reg[0]) is unused and will be removed from module rgb2dvi.
---------------------------------------------------------------------------------
Finished Cross Boundary and Area Optimization : Time (s): cpu = 00:00:13 ; elapsed = 00:00:15 . Memory (MB): peak = 804.219 ; gain = 453.453
---------------------------------------------------------------------------------

Report RTL Partitions: 
+-+--------------+------------+----------+
| |RTL Partition |Replication |Instances |
+-+--------------+------------+----------+
+-+--------------+------------+----------+
---------------------------------------------------------------------------------
Start Applying XDC Timing Constraints
---------------------------------------------------------------------------------
WARNING: [Synth 8-565] redefining clock 'U0/SerialClk'
---------------------------------------------------------------------------------
Finished Applying XDC Timing Constraints : Time (s): cpu = 00:00:21 ; elapsed = 00:00:24 . Memory (MB): peak = 804.219 ; gain = 453.453
---------------------------------------------------------------------------------
---------------------------------------------------------------------------------
Start Timing Optimization
---------------------------------------------------------------------------------
---------------------------------------------------------------------------------
Finished Timing Optimization : Time (s): cpu = 00:00:21 ; elapsed = 00:00:25 . Memory (MB): peak = 824.801 ; gain = 474.035
---------------------------------------------------------------------------------

Report RTL Partitions: 
+-+--------------+------------+----------+
| |RTL Partition |Replication |Instances |
+-+--------------+------------+----------+
+-+--------------+------------+----------+
---------------------------------------------------------------------------------
Start Technology Mapping
---------------------------------------------------------------------------------
---------------------------------------------------------------------------------
Finished Technology Mapping : Time (s): cpu = 00:00:22 ; elapsed = 00:00:25 . Memory (MB): peak = 827.160 ; gain = 476.395
---------------------------------------------------------------------------------

Report RTL Partitions: 
+-+--------------+------------+----------+
| |RTL Partition |Replication |Instances |
+-+--------------+------------+----------+
+-+--------------+------------+----------+
---------------------------------------------------------------------------------
Start IO Insertion
---------------------------------------------------------------------------------
---------------------------------------------------------------------------------
Start Flattening Before IO Insertion
---------------------------------------------------------------------------------
---------------------------------------------------------------------------------
Finished Flattening Before IO Insertion
---------------------------------------------------------------------------------
---------------------------------------------------------------------------------
Start Final Netlist Cleanup
---------------------------------------------------------------------------------
---------------------------------------------------------------------------------
Finished Final Netlist Cleanup
---------------------------------------------------------------------------------
---------------------------------------------------------------------------------
Finished IO Insertion : Time (s): cpu = 00:00:23 ; elapsed = 00:00:26 . Memory (MB): peak = 827.160 ; gain = 476.395
---------------------------------------------------------------------------------

Report Check Netlist: 
+------+------------------+-------+---------+-------+------------------+
|      |Item              |Errors |Warnings |Status |Description       |
+------+------------------+-------+---------+-------+------------------+
|1     |multi_driven_nets |      0|        0|Passed |Multi driven nets |
+------+------------------+-------+---------+-------+------------------+
---------------------------------------------------------------------------------
Start Renaming Generated Instances
---------------------------------------------------------------------------------
---------------------------------------------------------------------------------
Finished Renaming Generated Instances : Time (s): cpu = 00:00:23 ; elapsed = 00:00:26 . Memory (MB): peak = 827.160 ; gain = 476.395
---------------------------------------------------------------------------------

Report RTL Partitions: 
+-+--------------+------------+----------+
| |RTL Partition |Replication |Instances |
+-+--------------+------------+----------+
+-+--------------+------------+----------+
---------------------------------------------------------------------------------
Start Rebuilding User Hierarchy
---------------------------------------------------------------------------------
---------------------------------------------------------------------------------
Finished Rebuilding User Hierarchy : Time (s): cpu = 00:00:23 ; elapsed = 00:00:26 . Memory (MB): peak = 827.160 ; gain = 476.395
---------------------------------------------------------------------------------
---------------------------------------------------------------------------------
Start Renaming Generated Ports
---------------------------------------------------------------------------------
---------------------------------------------------------------------------------
Finished Renaming Generated Ports : Time (s): cpu = 00:00:23 ; elapsed = 00:00:26 . Memory (MB): peak = 827.160 ; gain = 476.395
---------------------------------------------------------------------------------
---------------------------------------------------------------------------------
Start Handling Custom Attributes
---------------------------------------------------------------------------------
---------------------------------------------------------------------------------
Finished Handling Custom Attributes : Time (s): cpu = 00:00:23 ; elapsed = 00:00:26 . Memory (MB): peak = 827.160 ; gain = 476.395
---------------------------------------------------------------------------------
---------------------------------------------------------------------------------
Start Renaming Generated Nets
---------------------------------------------------------------------------------
---------------------------------------------------------------------------------
Finished Renaming Generated Nets : Time (s): cpu = 00:00:23 ; elapsed = 00:00:26 . Memory (MB): peak = 827.160 ; gain = 476.395
---------------------------------------------------------------------------------
---------------------------------------------------------------------------------
Start Writing Synthesis Report
---------------------------------------------------------------------------------

Report BlackBoxes: 
+-+--------------+----------+
| |BlackBox name |Instances |
+-+--------------+----------+
+-+--------------+----------+

Report Cell Usage: 
+------+------------+------+
|      |Cell        |Count |
+------+------------+------+
|1     |LUT1        |     5|
|2     |LUT2        |    16|
|3     |LUT3        |    41|
|4     |LUT4        |    17|
|5     |LUT5        |    33|
|6     |LUT6        |    80|
|7     |MUXF7       |     2|
|8     |OSERDESE2   |     4|
|9     |OSERDESE2_1 |     4|
|10    |PLLE2_ADV   |     1|
|11    |FDPE        |     8|
|12    |FDRE        |   119|
|13    |FDSE        |    15|
|14    |OBUFDS      |     4|
+------+------------+------+

Report Instance Areas: 
+------+-------------------------------------+--------------------------+------+
|      |Instance                             |Module                    |Cells |
+------+-------------------------------------+--------------------------+------+
|1     |top                                  |                          |   349|
|2     |  U0                                 |rgb2dvi                   |   349|
|3     |    \ClockGenInternal.ClockGenX      |ClockGen                  |    12|
|4     |      LockLostReset                  |ResetBridge_5             |     3|
|5     |        SyncAsyncx                   |SyncAsync_6               |     2|
|6     |      PLL_LockSyncAsync              |SyncAsync__parameterized1 |     2|
|7     |    ClockSerializer                  |OutputSERDES              |     3|
|8     |    \DataEncoders[0].DataEncoder     |TMDS_Encoder              |   112|
|9     |    \DataEncoders[0].DataSerializer  |OutputSERDES_0            |     3|
|10    |    \DataEncoders[1].DataEncoder     |TMDS_Encoder_1            |   107|
|11    |    \DataEncoders[1].DataSerializer  |OutputSERDES_2            |     3|
|12    |    \DataEncoders[2].DataEncoder     |TMDS_Encoder_3            |   104|
|13    |    \DataEncoders[2].DataSerializer  |OutputSERDES_4            |     3|
|14    |    LockLostReset                    |ResetBridge               |     2|
|15    |      SyncAsyncx                     |SyncAsync                 |     2|
+------+-------------------------------------+--------------------------+------+
---------------------------------------------------------------------------------
Finished Writing Synthesis Report : Time (s): cpu = 00:00:23 ; elapsed = 00:00:26 . Memory (MB): peak = 827.160 ; gain = 476.395
---------------------------------------------------------------------------------
Synthesis finished with 0 errors, 0 critical warnings and 17 warnings.
Synthesis Optimization Runtime : Time (s): cpu = 00:00:15 ; elapsed = 00:00:20 . Memory (MB): peak = 827.160 ; gain = 179.336
Synthesis Optimization Complete : Time (s): cpu = 00:00:23 ; elapsed = 00:00:26 . Memory (MB): peak = 827.160 ; gain = 476.395
INFO: [Project 1-571] Translating synthesized netlist
INFO: [Netlist 29-17] Analyzing 7 Unisim elements for replacement
INFO: [Netlist 29-28] Unisim Transformation completed in 0 CPU seconds
INFO: [Project 1-570] Preparing netlist for logic optimization
INFO: [Opt 31-138] Pushed 0 inverter(s) to 0 load pin(s).
INFO: [Project 1-111] Unisim Transformation Summary:
No Unisim elements were transformed.

INFO: [Common 17-83] Releasing license: Synthesis
55 Infos, 22 Warnings, 0 Critical Warnings and 0 Errors encountered.
synth_design completed successfully
synth_design: Time (s): cpu = 00:00:25 ; elapsed = 00:00:29 . Memory (MB): peak = 827.160 ; gain = 488.426
WARNING: [Constraints 18-5210] No constraint will be written out.
INFO: [Common 17-1381] The checkpoint 'C:/Users/Opex9020/Desktop/SEA-Tutorial/Experiment-of-SEA/FPGA-Demo-Project/ADC-Demo/ADC_Demo/ADC_Demo.runs/rgb2dvi_0_synth_1/rgb2dvi_0.dcp' has been generated.
INFO: [Coretcl 2-1482] Added synthesis output to IP cache for IP c:/Users/Opex9020/Desktop/SEA-Tutorial/Experiment-of-SEA/FPGA-Demo-Project/ADC-Demo/ADC_Demo/ADC_Demo.srcs/sources_1/ip/rgb2dvi_0/rgb2dvi_0.xci
INFO: [Coretcl 2-1174] Renamed 14 cell refs.
WARNING: [Constraints 18-5210] No constraint will be written out.
INFO: [Common 17-1381] The checkpoint 'C:/Users/Opex9020/Desktop/SEA-Tutorial/Experiment-of-SEA/FPGA-Demo-Project/ADC-Demo/ADC_Demo/ADC_Demo.runs/rgb2dvi_0_synth_1/rgb2dvi_0.dcp' has been generated.
INFO: [runtcl-4] Executing : report_utilization -file rgb2dvi_0_utilization_synth.rpt -pb rgb2dvi_0_utilization_synth.pb
report_utilization: Time (s): cpu = 00:00:00 ; elapsed = 00:00:00.017 . Memory (MB): peak = 827.160 ; gain = 0.000
INFO: [Common 17-206] Exiting Vivado at Tue Nov 12 16:17:44 2019...
